{"schema_version":"0.3","source_type":"EXECUTION_RECEIPT","execution_subtype":"CI_RUN","execution":{"provider":"GitHub Actions","workflow_name":"verify","run_id":32243549719,"run_number":688,"head_sha":"351ef6b63a970330b3c2df485f0c89f30f68cd84","result":"success"},"source_receipt_hash":"6efecee831eb502211e3a8ff6282be4950b564199e03fdfaeeee780cbcbe4246","evidence_state":"PROVEN_EXECUTION","scope":["GitHub Actions workflow execution on PR #510 head"],"limitations":["CI execution does not prove production deployment","CI execution does not prove employment","CI execution does not create institutional authority"],"external_witness":null,"allowed_resume_language":"Verified successful execution of the verify workflow on GitHub Actions for the bounded repository commit.","production_proof_created":false,"employment_created":false,"authority_created":false}
